{
    "id": "log_abc123",
    "cleaner_id": "user_456",
    "checkpoint_id": "cp_789",
    "building_id": "bld_001",
    "sync_status": "synced",
    "proof_of_presence": {
        "nfc_tap_timestamp": "2025-12-28T12:00:00Z",
        "nfc_payload_hash": "sha256:abc123def456...",
        "geo_location": {
            "latitude": 40.7128,
            "longitude": -74.0060,
            "accuracy_meters": 5.0
        }
    },
    "proof_of_quality": {
        "photo_storage_path": "gs://cleanvee-app/logs/log_abc123/photo.jpg",
        "ai_inference_timestamp": "2025-12-28T12:00:05Z",
        "ai_model_used": "gemini-1.5-flash",
        "inference_time_ms": 1200,
        "detected_objects": [
            {
                "label": "clean_floor",
                "confidence": 0.95,
                "bounding_box": {
                    "x": 0.1,
                    "y": 0.2,
                    "w": 0.8,
                    "h": 0.6
                }
            }
        ],
        "overall_score": 92,
        "passed_validation": true
    },
    "verification_result": {
        "status": "verified",
        "confidence": 0.95
    },
    "created_at": "2025-12-28T12:00:10Z"
}